{
  "child_id": "olivia",
  "child_name": "Olivia",
  "as_of": "2026-04-27",
  "records": [
    {
      "vaccine": "Full pediatric history",
      "series": "unknown",
      "dose": "unknown",
      "status": "unknown",
      "history_confidence": "unknown",
      "date": null,
      "provider": null,
      "due_date": null,
      "notes": "No checked-in immunization source documents; tracker intentionally avoids schedule inference.",
      "sources": [
        {
          "document": "missing",
          "type": "parent_report",
          "captured_on": null,
          "location": null
        }
      ]
    }
  ]
}
